{
  "case_id": "ORIGINAL-AFTERMATH-NEXT-ACTION-IMMEDIATE",
  "dramatic_structure": {
    "goal": "preserve an immediate live correction instead of treating it as aftermath",
    "objectives": [
      "complete the shutdown"
    ],
    "obstacle": "all simultaneous safety states must remain visible",
    "stakes": "the correction fails if one state is hidden",
    "subtext": "none asserted",
    "tactic_change": "warning becomes coordinated shutdown"
  },
  "locked_facts": [
    {
      "fact_id": "FACT-01",
      "fact_type": "visible_result",
      "source_ref": "locked-script.md#FACT-01",
      "status": "LOCKED",
      "value": "The visible level reaches a warning mark but the pump continues running."
    },
    {
      "fact_id": "FACT-02",
      "fact_type": "next_action_states",
      "source_ref": "locked-script.md#FACT-02",
      "status": "LOCKED",
      "value": "All three participants must keep the live gauge, valve, and shutdown sequence visible together."
    },
    {
      "fact_id": "FACT-03",
      "fact_type": "terminal_environment_state",
      "source_ref": "locked-script.md#FACT-03",
      "status": "LOCKED",
      "value": "No separate terminal aftermath exists until the immediate correction is complete."
    }
  ],
  "priority_constraints": [],
  "rights_boundary": {
    "contains_private_script": false,
    "contains_reference_surface": false,
    "project_original": true
  },
  "routing_signals": [
    "consequential_result_with_multiple_next_states",
    "next_action_prioritization_required",
    "immediate_next_action_supersedes_aftermath"
  ],
  "scene_problem": {
    "primary": "PUBLIC_REVELATION",
    "secondary": [],
    "status": "LOCKED"
  },
  "schema_version": "director-routing-input/0.1",
  "subject_matter_tags": [
    "pump_test"
  ],
  "unknown_fact_types": []
}
