{
  "case_id": "ORIGINAL-ACTION-CAUSALITY",
  "dramatic_structure": {
    "goal": "preserve one visible cause and the distinct responses of a group",
    "objectives": [
      "clear the rack path",
      "stop the rack safely"
    ],
    "obstacle": "the rack is already moving",
    "stakes": "the marked route must be cleared before intervention",
    "subtext": "the lead acts only after every response is visible",
    "tactic_change": "warning becomes coordinated clearance and then restraint"
  },
  "locked_facts": [
    {
      "fact_id": "FACT-01",
      "fact_type": "action_source",
      "source_ref": "locked-script.md#FACT-01",
      "status": "LOCKED",
      "value": "A loose wheel stop is visibly displaced before an unpowered equipment rack begins rolling."
    },
    {
      "fact_id": "FACT-02",
      "fact_type": "target_state",
      "source_ref": "locked-script.md#FACT-02",
      "status": "LOCKED",
      "value": "The rack changes from stationary to rolling while three marked lanes remain visible."
    },
    {
      "fact_id": "FACT-03",
      "fact_type": "visible_result",
      "source_ref": "locked-script.md#FACT-03",
      "status": "LOCKED",
      "value": "After the lanes clear, a floor chock stops the rack and the stopped state remains readable."
    }
  ],
  "priority_constraints": [],
  "rights_boundary": {
    "contains_private_script": false,
    "contains_reference_surface": false,
    "project_original": true
  },
  "routing_signals": [
    "visible_action_source",
    "target_state_change",
    "result_readable"
  ],
  "scene_problem": {
    "primary": "ACTION_CAUSALITY",
    "secondary": [],
    "status": "LOCKED"
  },
  "schema_version": "director-routing-input/0.1",
  "subject_matter_tags": [
    "safe_physical_action"
  ],
  "unknown_fact_types": []
}
