{
  "case_id": "ORIGINAL-PERFORMANCE-OWNER-HOLD",
  "dramatic_structure": {
    "goal": "make one uninterrupted visible answer progression readable",
    "objectives": [
      "identify the missing safety entry"
    ],
    "obstacle": "the technician must complete the visible review before the receiver responds",
    "stakes": "the equipment cannot be released until the entry is resolved",
    "subtext": "none asserted",
    "tactic_change": "document checking becomes a direct answer"
  },
  "locked_facts": [
    {
      "fact_id": "FACT-01",
      "fact_type": "relation_state",
      "source_ref": "locked-script.md#FACT-01",
      "status": "LOCKED",
      "value": "The reviewer and technician are established on opposite sides of a plain table."
    },
    {
      "fact_id": "FACT-02",
      "fact_type": "performance_progression",
      "source_ref": "locked-script.md#FACT-02",
      "status": "LOCKED",
      "value": "The technician checks three blank log rows, stops at the missing entry, and places both hands flat before answering."
    },
    {
      "fact_id": "FACT-03",
      "fact_type": "owner_endpoint",
      "source_ref": "locked-script.md#FACT-03",
      "status": "LOCKED",
      "value": "The reviewer remains outside the critical frame until the technician finishes the visible sequence."
    }
  ],
  "priority_constraints": [],
  "rights_boundary": {
    "contains_private_script": false,
    "contains_reference_surface": false,
    "project_original": true
  },
  "routing_signals": [
    "single_performance_progression"
  ],
  "scene_problem": {
    "primary": "INTERROGATION",
    "secondary": [],
    "status": "LOCKED"
  },
  "schema_version": "director-routing-input/0.1",
  "subject_matter_tags": [
    "equipment_review"
  ],
  "unknown_fact_types": []
}
